{
  "schema_version": "2.0",
  "hospital_id": "H2",
  "metadata": {
    "hospital_id": "H2",
    "contract_number": "INS-H2-2024-1183",
    "provider": "St. Auben Metropolitan Hospital Trust",
    "payer": "Meridian Health Assurance Group",
    "effective_from": "2024-01-01",
    "effective_to": "2025-12-31",
    "currency": "GBP",
    "rounding": "half_up_cent"
  },
  "services": [
    {
      "service_id": "6.6",
      "name": "Advanced Dermatologic Specimen Analysis",
      "aliases": [],
      "unit": "per_item",
      "rates": [
        {
          "effective_from": null,
          "effective_to": null,
          "rate_cents": 2215000,
          "evidence": {
            "source_file": "master_services_agreement.md",
            "section": "Article VI — Contracted Services (Two Group)",
            "text": "6.6 In respect of Advanced Dermatologic Specimen Analysis, the Provider shall invoice the Payer at the rate of GBP 221.50 per item supplied. The Provider shall not bill more than twenty-four (24) items of this Service for a Patient on a single Service Day."
          }
        }
      ],
      "daily_cap": 24
    },
    {
      "service_id": "aecc-18.3",
      "name": "Advanced Endocrine Case Conference",
      "aliases": [],
      "unit": "per_visit",
      "rates": [
        {
          "effective_from": null,
          "effective_to": null,
          "rate_cents": 17400,
          "evidence": {
            "source_file": "master_services_agreement.md",
            "section": "Article XVIII — Contracted Services (Eight Group), 18.3",
            "text": "In respect of Advanced Endocrine Case Conference, the Provider shall invoice the Payer at the rate of GBP 174.00 per visit."
          }
        }
      ],
      "daily_cap": null
    },
    {
      "service_id": "advanced_gastrointestinal_endoscopic_procedure",
      "name": "Advanced Gastrointestinal Endoscopic Procedure",
      "aliases": [],
      "unit": "per_procedure",
      "rates": [
        {
          "effective_from": null,
          "effective_to": null,
          "rate_cents": 377750,
          "evidence": {
            "source_file": "master_services_agreement.md",
            "section": "Article XIV — Contracted Services (Six Group) > 14.4",
            "text": "In respect of Advanced Gastrointestinal Endoscopic Procedure, the Provider shall invoice the Payer at the rate of GBP 3,777.50 per procedure."
          }
        }
      ],
      "daily_cap": null
    },
    {
      "service_id": "advanced_infectious_isolation_room_occupancy",
      "name": "Advanced Infectious Isolation Room Occupancy",
      "aliases": [],
      "unit": "per_day",
      "rates": [
        {
          "effective_from": "2024-01-01",
          "effective_to": "2025-12-31",
          "rate_cents": 164825,
          "evidence": {
            "source_file": "master_services_agreement.md",
            "section": "Article IV — Contracted Services (One Group)",
            "text": "4.1 In respect of Advanced Infectious Isolation Room Occupancy, the Provider shall invoice the Payer at the rate of GBP 1,648.25 per day of service. The Provider shall not bill more than twenty-four (24) days of this Service for a Patient on a single Service Day."
          }
        }
      ],
      "daily_cap": 24
    },
    {
      "service_id": "advanced_rheumatologic_isolation_room_occupancy",
      "name": "Advanced Rheumatologic Isolation Room Occupancy",
      "aliases": [],
      "unit": "per_night",
      "rates": [
        {
          "effective_from": null,
          "effective_to": null,
          "rate_cents": 141675,
          "evidence": {
            "source_file": "master_services_agreement.md",
            "section": "Article X — Contracted Services (Four Group)",
            "text": "10.5 In respect of Advanced Rheumatologic Isolation Room Occupancy, the Provider shall invoice the Payer at the rate of GBP 1,416.75 per night of occupancy."
          }
        }
      ],
      "daily_cap": null
    },
    {
      "service_id": "ambulatory_haematology_nutritional_support",
      "name": "Ambulatory Haematology Nutritional Support",
      "aliases": [],
      "unit": "per_unit_dispensed",
      "rates": [
        {
          "effective_from": null,
          "effective_to": null,
          "rate_cents": 8675,
          "evidence": {
            "source_file": "master_services_agreement.md",
            "section": "Article XXVI — Contracted Services (Twelve Group)",
            "text": "In respect of Ambulatory Haematology Nutritional Support, the Provider shall invoice the Payer at the rate of GBP 86.75 per unit dispensed."
          }
        }
      ],
      "daily_cap": null
    },
    {
      "service_id": "S2",
      "name": "Ambulatory Vascular Infusion Therapy",
      "aliases": [],
      "unit": "per_hour",
      "rates": [
        {
          "effective_from": null,
          "effective_to": null,
          "rate_cents": 4225,
          "evidence": {
            "source_file": "master_services_agreement.md",
            "section": "Article XXII — Contracted Services (Ten Group)",
            "text": "22.2 In respect of Ambulatory Vascular Infusion Therapy, the Provider shall invoice the Payer at the rate of GBP 42.25 per hour."
          }
        }
      ],
      "daily_cap": null
    },
    {
      "service_id": "assisted_gastrointestinal_biopsy_procedure",
      "name": "Assisted Gastrointestinal Biopsy Procedure",
      "aliases": [],
      "unit": "per_procedure",
      "rates": [
        {
          "effective_from": null,
          "effective_to": null,
          "rate_cents": 379625,
          "evidence": {
            "source_file": "master_services_agreement.md",
            "section": "Article X — Contracted Services (Four Group)",
            "text": "10.6 In respect of Assisted Gastrointestinal Biopsy Procedure, the Provider shall invoice the Payer at the rate of GBP 3,796.25 per procedure."
          }
        }
      ],
      "daily_cap": null
    },
    {
      "service_id": "assisted_infectious_telemetry_monitoring",
      "name": "Assisted Infectious Telemetry Monitoring",
      "aliases": [],
      "unit": "per_hour_per_item",
      "rates": [
        {
          "effective_from": "2024-01-01",
          "effective_to": "2025-12-31",
          "rate_cents": 10625,
          "evidence": {
            "source_file": "master_services_agreement.md",
            "section": "Article IV — Contracted Services (One Group)",
            "text": "4.2 In respect of Assisted Infectious Telemetry Monitoring, the Provider shall invoice the Payer at the rate of GBP 106.25 per hour, per item."
          }
        }
      ],
      "daily_cap": null
    },
    {
      "service_id": "8.1",
      "name": "Assisted Musculoskeletal Diagnostic Imaging",
      "aliases": [],
      "unit": "per_item",
      "rates": [
        {
          "effective_from": null,
          "effective_to": null,
          "rate_cents": 1805000,
          "evidence": {
            "source_file": "master_services_agreement.md",
            "section": "Article VIII — Contracted Services (Three Group)",
            "text": "8.1 In respect of Assisted Musculoskeletal Diagnostic Imaging, the Provider shall invoice the Payer at the rate of GBP 180.50 per item supplied."
          }
        }
      ],
      "daily_cap": null
    },
    {
      "service_id": "bedside_obstetric_physiotherapy_session",
      "name": "Bedside Obstetric Physiotherapy Session",
      "aliases": [],
      "unit": "per_hour",
      "rates": [
        {
          "effective_from": null,
          "effective_to": null,
          "rate_cents": 6950,
          "evidence": {
            "source_file": "master_services_agreement.md",
            "section": "Article XIV — Contracted Services (Six Group) > 14.5",
            "text": "In respect of Bedside Obstetric Physiotherapy Session, the Provider shall invoice the Payer at the rate of GBP 69.50 per hour."
          }
        }
      ],
      "daily_cap": null
    },
    {
      "service_id": "borf-18.4",
      "name": "Bedside Ophthalmic Radiotherapy Fraction",
      "aliases": [],
      "unit": "per_procedure",
      "rates": [
        {
          "effective_from": null,
          "effective_to": null,
          "rate_cents": 123550,
          "evidence": {
            "source_file": "master_services_agreement.md",
            "section": "Article XVIII — Contracted Services (Eight Group), 18.4",
            "text": "In respect of Bedside Ophthalmic Radiotherapy Fraction, the Provider shall invoice the Payer at the rate of GBP 1,235.50 per procedure."
          }
        }
      ],
      "daily_cap": null
    },
    {
      "service_id": "S3",
      "name": "Bedside Pulmonary Pharmaceutical Dispensing",
      "aliases": [],
      "unit": "per_unit_dispensed",
      "rates": [
        {
          "effective_from": null,
          "effective_to": null,
          "rate_cents": 6900,
          "evidence": {
            "source_file": "master_services_agreement.md",
            "section": "Article XXII — Contracted Services (Ten Group)",
            "text": "22.3 In respect of Bedside Pulmonary Pharmaceutical Dispensing, the Provider shall invoice the Payer at the rate of GBP 69.00 per unit dispensed."
          }
        }
      ],
      "daily_cap": null
    },
    {
      "service_id": "comprehensive_haematology_transport_service",
      "name": "Comprehensive Haematology Transport Service",
      "aliases": [],
      "unit": "per_item",
      "rates": [
        {
          "effective_from": null,
          "effective_to": null,
          "rate_cents": 16650,
          "evidence": {
            "source_file": "master_services_agreement.md",
            "section": "Article XXVI — Contracted Services (Twelve Group)",
            "text": "In respect of Comprehensive Haematology Transport Service, the Provider shall invoice the Payer at the rate of GBP 166.50 per item supplied."